question_text,image_source,delay_seconds
Tell me about your experience with teamwork.,C:\scripts\PSInterviewGriller\pictures\calm_interviewer.png,5
Describe a time you showed leadership skills.,C:\scripts\PSInterviewGriller\pictures\happy_interviewer.png,30
What are your career goals for the next 5 years?,C:\scripts\PSInterviewGriller\pictures\calm_interviewer.png,30
How do you handle stressful situations?,C:\scripts\PSInterviewGriller\pictures\happy_interviewer.png,30
What motivates you in a work environment?,C:\scripts\PSInterviewGriller\pictures\calm_interviewer.png,30